movie_id,title,description
1193,One Flew Over the Cuckoo's Nest (1975),No description available
661,James and the Giant Peach (1996),"Maria marries a young soldier in the last days of World War II, only for him to go missing in the war. She must rely on her beauty and ambition to navigate the difficult post-war years alone."
914,My Fair Lady (1964),Dictator Adenoid Hynkel tries to expand his empire while a poor Jewish barber tries to avoid persecution from Hynkel's regime.
3408,Erin Brockovich (2000),Experimental short dealing with the subject of F to M Transexuals.
2355,"Bug's Life, A (1998)",A man who lost his family in the September 11 attack on New York City runs into his old college roommate. Rekindling the friendship is the one thing that appears able to help the man recover from his grief.
1197,"Princess Bride, The (1987)",No description available
1287,Ben-Hur (1959),No description available
2804,"Christmas Story, A (1983)",
594,Snow White and the Seven Dwarfs (1937),"Viktor Navorski is a man without a country; his plane took off just as a coup d'etat exploded in his homeland, leaving it in shambles, and now he's stranded at Kennedy Airport, where he's holding a passport that nobody recognizes. While quarantined in the transit lounge until authorities can figure out what to do with him, Viktor simply goes on living – and courts romance with a beautiful flight attendant."
919,"Wizard of Oz, The (1939)","In Japan, the vampire-hunter Saya, who is a powerful original, is sent by her liaison with the government, David, posed as a teenage student to the Yokota High School on the eve of Halloween to hunt down vampires. Saya asks David to give a new katana to her. Soon she saves the school nurse Makiho Amano from two vampires disguised of classmates and Makiho witnesses her fight against the powerful demon."
595,Beauty and the Beast (1991),"Scout Finch, 6, and her older brother Jem live in sleepy Maycomb, Alabama, spending much of their time with their friend Dill and spying on their reclusive and mysterious neighbor, Boo Radley. When Atticus, their widowed father and a respected lawyer, defends a black man named Tom Robinson against fabricated rape charges, the trial and tangent events expose the children to evils of racism and stereotyping."
938,Gigi (1958),"Two bounty hunters are in pursuit of ""El Indio,"" one of the most wanted fugitives in the western territories, and his gang."
2398,Miracle on 34th Street (1947),"At fifty, René Maugras has lost everything. This wealthy press boss fell into a coma and was rushed to hospital. He has since emerged from his worrying state of health but remains unable to move and communicate. He must also begin rehabilitation, which turns out to be particularly humiliating. Fortunately for him there is Blanche, his nurse, who surrounds him with affection. Blanche takes her case to heart."
2918,Ferris Bueller's Day Off (1986),No description available
1035,"Sound of Music, The (1965)",No description available
2791,Airplane! (1980),"After their narrow escape at the end of ""Pitch Black,""  Riddick, Jack and the Imam find themselves at the mercy of a madwoman who intends to entomb Riddick forever as part of a twisted art exhibit.  With little but a shiv and Riddick's innate viciousness to aid them, Riddick and his allies must find a way to escape from their captor and her band of mercenaries."
2687,Tarzan (1999),"After a freak accident, an invisible yuppie runs for his life from a treacherous CIA official while trying to cope with his new life."
2018,Bambi (1942),"San Francisco's premiere wedding planner, Mary Fiore is rescued from an accident by the man of her dreams, pediatrician Steve Edison, only to find he is the fiancé of her latest client. As Mary continues making their wedding arrangements, she and Steve are put into a string of uncomfortable situations that force them to face their mutual attraction."
3105,Awakenings (1990),"Victor Frankenstein witnesses his creation turn uncontrollable after he's duped by his associate, Dr. Polidori."
2797,Big (1988),
2321,Pleasantville (1998),"Angela de Marco is fed up with her gangster husband's line of work and wants no part of the crime world. When her husband is killed for having an affair with the mistress of mob boss Tony ""The Tiger"" Russo, Angela and her son depart for New York City to make a fresh start. Unfortunately, Tony has set his sights upon Angela -- and so has an undercover FBI agent looking to use her to bust Tony."
720,Wallace & Gromit: The Best of Aardman Animation (1996),No description available
1270,Back to the Future (1985),No description available
527,Schindler's List (1993),"A drama about a Maori family living in Auckland, New Zealand. Lee Tamahori tells the story of Beth Heke’s strong will to keep her family together during times of unemployment and abuse from her violent and alcoholic husband."
2340,Meet Joe Black (1998),No description available
48,Pocahontas (1995),No description available
1097,E.T. the Extra-Terrestrial (1982),No description available
1721,Titanic (1997),"The ""Trinity"" crew makes another modern era film. Plata and Salud are pilots ditching aircraft for insurance money. They wind up crashing for real in the jungles of South America. The plot involves ""Mr. Big"", who is buying the diamonds from the miners for much too little, and has thugs who keep the price down. Of course, Plata and Salud side with the miners"
1545,Ponette (1996),No description available
745,"Close Shave, A (1995)","Following an unexpected tragedy, child psychologist Malcolm Crowe meets a nine year old boy named Cole Sear, who is hiding a dark secret."
2294,Antz (1998),"When Jay and Silent Bob learn that their comic-book alter egos, Bluntman and Chronic, have been sold to Hollywood as part of a big-screen movie that leaves them out of any royalties, the pair travels to Tinseltown to sabotage the production."
3186,"Girl, Interrupted (1999)",No description available
1566,Hercules (1997),"A group of German boys are ordered to protect a small bridge in their home village during the waning months of the second world war. Truckloads of defeated, cynical Wehrmacht soldiers flee the approaching American troops, but the boys, full of enthusiasm for the ""blood and honor"" Nazi ideology, stay to defend the useless bridge. The film is based on a West German anti-war novel of the same name, written by Gregor Dorfmeister."
588,Aladdin (1992),"Rose, a desperate mother takes her adopted daughter, Sharon, to the town of Silent Hill in an attempt to cure her of her ailment. After a violent car crash, Sharon disappears and Rose begins a desperate search to get her back. She descends into the center of the twisted reality of a town's terrible secret. Pursued by grotesquely deformed creatures and townspeople stuck in permanent purgatory, Rose begins to uncover the truth behind the apocalyptic disaster that burned the town 30 years earlier."
1907,Mulan (1998),"Twenty-something Richard travels to Thailand and finds himself in possession of a strange map. Rumours state that it leads to a solitary beach paradise, a tropical bliss - excited and intrigued, he sets out to find it."
783,"Hunchback of Notre Dame, The (1996)","In the early years of the 20th century, Mohandas K. Gandhi, a British-trained lawyer, forsakes all worldly possessions to take up the cause of Indian independence. Faced with armed resistance from the British government, Gandhi adopts a policy of 'passive resistance', endeavouring to win freedom for his people without resorting to bloodshed."
1836,"Last Days of Disco, The (1998)",Esther's life is panning out nicely. She will soon move in with her boyfriend Vincent and she seems set to get a permanent position at the public relations company where she freelances. All would be fine if Esther didn't accidentally discover a piercing curiosity about her own body.
1022,Cinderella (1950),No description available
2762,"Sixth Sense, The (1999)","Robert Tisdall finds on the beach the corpse of a woman he knew. Others wrongly conclude that he is the murderer. Fleeing, he desperately attempts to prove that he is not the killer. A young woman becomes embroiled in the effort."
150,Apollo 13 (1995),"A hard-nosed cop reluctantly teams up with a wise-cracking criminal temporarily paroled to him, in order to track down a killer."
1,Toy Story (1995),No description available
1961,Rain Man (1988),B Movie Legend Bruce Campbell is mistaken for his character Ash from the Evil Dead trilogy and forced to fight a real monster in a small town in Oregon.
1962,Driving Miss Daisy (1989),"A posthumous look at the last days of Guenther's life as he, his best friend, and his sister let loose on a four-day binge of alcohol, drugs, and sex."
2692,Run Lola Run (Lola rennt) (1998),"A documentary on the late American entertainer Dean Reed, who became a huge star in East Germany after settling there in 1973."
260,Star Wars: Episode IV - A New Hope (1977),"Richard Hanney has a rude awakening when a glamorous female spy falls into his bed - with a knife in her back. Having a bit of trouble explaining it all to Scotland Yard, he heads for the hills of Scotland to try to clear his name by locating the spy ring known as The 39 Steps."
1028,Mary Poppins (1964),No description available
1029,Dumbo (1941),No description available
1207,To Kill a Mockingbird (1962),No description available
2028,Saving Private Ryan (1998),"Lloyd, an eternal optimist, seeks to capture the heart of Diane, an unattainable high school beauty and straight-A student. He surprises just about everyone-including himself-when she returns the sentiment. But Diane's over-possessive, divorced Dad disapproves and it's going to take more than just the power of love to conquer all."
531,"Secret Garden, The (1993)","Wallace rents out Gromit's former bedroom to a penguin, who takes up an interest in the techno pants created by Wallace. However, Gromit later learns that the penguin is a wanted criminal."
3114,Toy Story 2 (1999),"As a Civil War veteran spends years searching for a young niece captured by Indians, his motivation becomes increasingly questionable."
608,Fargo (1996),"Kay and Jay reunite to provide our best, last and only line of defense against a sinister seductress who levels the toughest challenge yet to the MIB's untarnished mission statement – protecting Earth from the scum of the universe. It's been four years since the alien-seeking agents averted an intergalactic disaster of epic proportions. Now it's a race against the clock as Jay must convince Kay – who not only has absolutely no memory of his time spent with the MIB, but is also the only living person left with the expertise to save the galaxy – to reunite with the MIB before the earth submits to ultimate destruction."
1246,Dead Poets Society (1989),"His Wife is dead and his Son hates him, but this old man still has fight in him!  When he loses a highly publicized virtual boxing match to ex-champ Rocky Balboa, reigning heavyweight titleholder Mason Dixon retaliates by challenging Rocky to a nationally televised, 10-round exhibition bout. To the surprise of his son and friends, Rocky agrees to come out of retirement and face an opponent who's faster, stronger, and thirty years his junior."
1357,Shine (1996),No description available
3068,"Verdict, The (1982)","A scientist obsessed with creating life steals body parts to put together his ""creation."" Released as a feature on video, this was originally shown in two installments on TV as part of the Wide World of Entertainment series."
1537,Shall We Dance? (Shall We Dansu?) (1996),"A rush-hour fender-bender on New York City's crowded FDR Drive, under most circumstances, wouldn't set off a chain reaction that could decimate two people's lives. But on this day, at this time, a minor collision will turn two complete strangers into vicious adversaries. Their means of destroying each other might be different, but their goals, ultimately, will be the same: Each will systematically try to dismantle the other's life in a reckless effort to reclaim something he has lost."
647,Courage Under Fire (1996),"Two years have passed since the final battle with Sephiroth. Though Midgar, city of mako, city of prosperity, has been reduced to ruins, its people slowly but steadily walk the road to reconstruction. However, a mysterious illness called Geostigma torments them. With no cure in sight, it brings death to the afflicted, one after another, robbing the people of their fledgling hope."
2194,"Untouchables, The (1987)","This teenage drama deals with the emotional chaos of a high school graduate at the beginning of a new period of his life. 19-year-old Daniel is frustrated: he wants his great love Luca to be the ""first"" woman in his life, but she seems to be unreachable, so he is still a virgin. During his community service as a male nurse, his boss Anna falls in love with him and they finally have sex. Suddenly Luca is interested in Daniel..."
648,Mission: Impossible (1996),"The story of a gentle-hearted beast in love with a simple and beautiful girl. She is drawn to the repellent but strangely fascinating Beast, who tests her fidelity by giving her a key, telling her that if she doesn't return it to him by a specific time, he will die of grief. She is unable to return the key on time, but it is revealed that the Beast is the genuinely handsome one. A simple tale of tragic love that turns into a surreal vision of death, desire, and beauty."
2268,"Few Good Men, A (1992)","After overhearing a shocking secret, precocious orphan Lyra Belacqua trades her carefree existence roaming the halls of Jordan College for an otherworldly adventure in the far North, unaware that it's part of her destiny."
2628,Star Wars: Episode I - The Phantom Menace (1999),No description available
1103,Rebel Without a Cause (1955),"In a world ravaged by crime, the entire island of Manhattan has been converted into a walled prison where brutal prisoners roam. After the US president crash-lands inside, war hero Snake Plissken has 24 hours to bring him back."
2916,Total Recall (1990),No description available
3468,"Hustler, The (1961)",No description available
1210,Star Wars: Episode VI - Return of the Jedi (1983),No description available
1792,U.S. Marshalls (1998),"In Martha's Vineyard, Mass., conjoined twins Walt and Bob Tenor make the best of their handicap by being the fastest grill cooks in town. While outgoing Walt hopes to one day become a famous actor, shy Bob prefers to stay out of the spotlight. When a fading Hollywood actress, Cher, decides to get her show ""Honey and the Beaze"" cancelled, she hires Walt -- and his brotherly appendage -- as her costars. But their addition surprisingly achieves the opposite."
1687,"Jackal, The (1997)","The world is shocked by the appearance of three talking chimpanzees, who arrived mysteriously in a spacecraft. Intrigued by their intelligence, humans use them for research - until the apes attempt to escape."
1213,GoodFellas (1990),"Tom Ripley is a calculating young man who believes it's better to be a fake somebody than a real nobody. Opportunity knocks in the form of a wealthy U.S. shipbuilder who hires Tom to travel to Italy to bring back his playboy son, Dickie. Ripley worms his way into the idyllic lives of Dickie and his girlfriend, plunging into a daring scheme of duplicity, lies and murder."
3578,Gladiator (2000),"The engineer MacAllan designs a tunnel, which will join America and Europe together on the seabed.  A group of American billionaires are financing the gigantic project, but the construction of the tunnel is proving to be as tedious as it is dangerous.  MacAllan's worst enemy is the speculator Woolf, who had embezzled the money for the construction and who is attempting to cover up his crime by carrying out acts of sabotage.  Also filmed in 1933 in a French-language version, LE TUNNEL, and remade in 1935 in England as TRANSATLATIC TUNNEL."
2881,Double Jeopardy (1999),No description available
3030,Yojimbo (1961),"After witnessing a man's death in a bizzare accident, Father Pergado goes on a spiritual retreat, where he encounters his alien double bent on world conquest."
1217,Ran (1985),No description available
434,Cliffhanger (1993),"From the youth directed novel of the same name by Greogor Tressnow comes a film by Detlev Buck that is a realistic portrait of life in the section of Berlin called Neukölln. It’s about power and weakness, delinquents and victims, and the difficulties a 15-year-old faces in a poor and criminal environment."
2126,Snake Eyes (1998),
3107,Backdraft (1991),"At the turn of the century, all of the Earth's monsters have been rounded up and kept safely on Monsterland. Chaos erupts when a race of she-aliens known as the Kilaaks unleash the monsters across the world."
3108,"Fisher King, The (1991)",No description available
3035,Mister Roberts (1955),"Tampering with life and death, Henry Frankenstein pieces together salvaged body parts to bring a human monster to life; the mad scientist's dreams are shattered by his creation's violent rage as the monster awakens to a world in which he is unwelcome."
1253,"Day the Earth Stood Still, The (1951)","Set in a blighted, inner-city neighbourhood of London, Breaking and Entering examines an affair which unfolds between a successful British landscape architect and Amira, a Bosnian woman – the mother of a troubled teen son – who was widowed by the war in Bosnia and Herzegovina."
1610,"Hunt for Red October, The (1990)","A romantic comedy about a man, a woman and a football team. Based on Nick Hornby's best selling autobiographical novel, Fever Pitch. English teacher Paul Ashworth believes his long standing obsession with Arsenal serves him well. But then he meets Sarah. Their relationship develops in tandem with Arsenal's roller coaster fortunes in the football league, both leading to a nail biting climax."
292,Outbreak (1995),"The American comedian/actor delivers a story about the alternative Hip Hop scene. A small town Ohio mans moves to Brooklyn, New York, to throw an unprecedented block party."
2236,Simon Birch (1998),Music DVD with rare live and TV performances from the period 1963-1975.
3071,Stand and Deliver (1987),"Frankenstein is a 2007 British television film produced by Impossible Pictures for ITV. It was written and directed by Jed Mercurio, adapted from Mary Shelley's original novel to a present-day setting. Dr. Victoria Frankenstein, a female geneticist, accidentally creates a monster while growing her son's clone from stem cells as an organ donor in an effort to prevent his imminent death."
902,Breakfast at Tiffany's (1961),"A scientist in a surrealist society kidnaps children to steal their dreams, hoping that they slow his aging process."
368,Maverick (1994),No description available
1259,Stand by Me (1986),"A veteran high school teacher befriends a younger art teacher, who is having an affair with one of her 15-year-old students. However, her intentions with this new ""friend"" also go well beyond platonic friendship."
3147,"Green Mile, The (1999)",The history of Frankenstein's journey from novel to stage to screen to icon.
1544,"Lost World: Jurassic Park, The (1997)","During her wedding ceremony, Rachel notices Luce in the audience and feels instantly drawn to her. The two women become close friends, and when Rachel learns that Luce is a lesbian, she realizes that despite her happy marriage to Heck, she is falling for Luce. As she questions her sexual orientation, Rachel must decide between her stable relationship with Heck and her exhilarating new romance with Luce."
1293,Gandhi (1982),No description available
1188,Strictly Ballroom (1992),No description available
3255,"League of Their Own, A (1992)",No description available
3256,Patriot Games (1992),No description available
3257,"Bodyguard, The (1992)",No description available
110,Braveheart (1995),"Valentine, a student model in Geneva, struggles with a possessive boyfriend and a troubled family. When she runs over a dog, she discovers that its owner, a retired judge, is illegally wiretapping and eavesdropping on his neighbors' phone calls. Although Valentine is outraged, she develops a strange bond with the judge – and as the two become closer, she finds herself caught in the middle of events that could change her life."
2278,Ronin (1998),No description available
2490,Payback (1999),No description available
1834,"Spanish Prisoner, The (1997)","After being hired to find an ex-con's former girlfriend, Philip Marlowe is drawn into a deeply complex web of mystery and deceit."
3471,Close Encounters of the Third Kind (1977),"Two Foreign Legion soldiers, Jean (Dennis O'Keefe) and Andre (Jean Pierre Aumont), accidentally discover the famed lost continent of Atlantis. Bewitched by the sultry, beauty of the Queen of Atlantis (Maria Montez) the two men vie for her affections; little realising that her previous lovers have been embalmed into statues that line the passages of her kingdom."
589,Terminator 2: Judgment Day (1991),No description available
1690,Alien: Resurrection (1997),"Three backpackers head to a Slovakian city that promises to meet their hedonistic expectations, with no idea of the hell that awaits them."
3654,"Guns of Navarone, The (1961)",No description available
2852,"Soldier's Story, A (1984)",
1945,On the Waterfront (1954),"In a remote woodland cabin, a small town doctor discovers Nell — a beautiful young hermit woman with many secrets."
982,Picnic (1955),"Near the end of the Korean War, a platoon of U.S. soldiers is captured by communists and brainwashed. Following the war, the platoon is returned home, and Sergeant Raymond Shaw is lauded as a hero by the rest of his platoon. However, the platoon commander, Captain Bennett Marco, finds himself plagued by strange nightmares and soon races to uncover a terrible plot."
1873,"Misérables, Les (1998)",Dr. Laura Bowman is a young widow who's unwittingly drawn into political turmoil while vacationing in Burma in the late 1980s. Bowman initially left San Francisco with her sister in an attempt to escape painful memories of her husband and son's violent deaths. But her fight to escape to Thailand could prove just as harrowing.
2858,American Beauty (1999),
1225,Amadeus (1984),No description available
515,"Remains of the Day, The (1993)",No description available
442,Demolition Man (1993),"Matti and Niila, growing up in the mid-sixties in the harsh and conservative environment of a Finnish-speaking part of Tornedalen in Swedish Laponia, close to the Finnish border. Their big dream is to become rock stars. In the present the now grown-up Matti feels guilt for the death of his drug-addicted rock star friend Niila."
2312,Children of a Lesser God (1986),"A man named Farmer sets out to rescue his kidnapped wife and avenge the death of his son – two acts committed by the Krugs, a race of animal-warriors who are controlled by the evil Gallian."
265,Like Water for Chocolate (Como agua para chocolate) (1992),"The story of a German singer named Willie who while working in Switzerland falls in love with a Jewish composer named Robert whose family is helping people to flee from the Nazis. Robert’s family is skeptical of Willie, thinking she could be a Nazi as she becomes famous for singing the song “Lili Marleen”."
1408,"Last of the Mohicans, The (1992)","Morgan Adams and her slave, William Shaw, are on a quest to recover the three portions of a treasure map. Unfortunately, the final portion is held by her murderous uncle, Dawg. Her crew is skeptical of her leadership abilities, so she must complete her quest before they mutiny against her. This is made yet more difficult by the efforts of the British crown to end her pirate raids."
1084,Bonnie and Clyde (1967),No description available
3699,Starman (1984),"A maniac on the loose is committing savage acts of slaughter, and one survivor may be the only key to unmasking the serial slayer known as the Half-Moon Killer. The mysterious half-moon lockets he leaves with his victims could be the only key to unraveling his sinister motives, but will that be enough before he completes his ice-cold plot to claim his intended seven victims?"
480,Jurassic Park (1993),"As the romantic monsoon rains loom, the extended Verma family reunites from around the globe for a last-minute arranged marriage in New Delhi. This film traces five intersecting stories, each navigating different aspects of love as they cross boundaries of class, continent and morality."
1442,Prefontaine (1997),"The film describes the microcosmos of the small village Wacken and shows the clash of the cultures, before and during the biggest heavy metal festival in Europe."
2067,Doctor Zhivago (1965),"When contact is lost with the crew of the first Mars expedition, a rescue mission is launched to discover their fate."
1265,Groundhog Day (1993),"Jesse Aarons trained all summer to become the fastest runner in school. So he's very upset when newcomer Leslie Burke outruns him and everyone else. Despite this and other differences including that she's rich, he's poor, she's a city girl, and he's a country boy the two become fast friends. Together they create Terabithia, a land of monsters, trolls, ogres, and giants where they rule as king and queen."
1370,Die Hard 2 (1990),"Combat has taken its toll on Rambo, but he's finally begun to find inner peace in a monastery. When Rambo's friend and mentor Col. Trautman asks for his help on a top secret mission to Afghanistan, Rambo declines but must reconsider when Trautman is captured."
1801,"Man in the Iron Mask, The (1998)",No description available
