movie_id,title,description
3494,True Grit (1969),No description available
421,Black Beauty (1994),"Renowned oceanographer Steve Zissou has sworn vengeance upon the rare shark that devoured a member of his crew. In addition to his regular team, he is joined on his boat by Ned, a man who believes Zissou to be his father, and Jane, a journalist pregnant by a married man. They travel the sea, all too often running into pirates and, perhaps more traumatically, various figures from Zissou's past, including his estranged wife, Eleanor."
3070,"Adventures of Buckaroo Bonzai Across the 8th Dimension, The (1984)",An obsessed scientist assembles a living being from parts of exhumed corpses.
2414,Young Sherlock Holmes (1985),
1479,"Saint, The (1997)","Peter Winter is a young schizophrenic who is desperately trying to get his daughter back from her adoptive family. He attempts to function in a world that, for him, is filled with strange voices, electrical noise, disconcerting images, and jarringly sudden emotional shifts. During his quest, he runs afoul of the law and an ongoing murder investigation."
517,Rising Sun (1993),No description available
952,Around the World in 80 Days (1956),No description available
60,"Indian in the Cupboard, The (1995)",No description available
3745,Titan A.E. (2000),No description available
2370,"Emerald Forest, The (1985)","Copenhagen, Denmark, 1962. When a high-ranking Soviet official decides to change sides, a French intelligence agent is caught up in a cold, silent and bloody spy war in which his own family will play a decisive role."
1216,"Big Blue, The (Le Grand Bleu) (1988)",No description available
2528,Logan's Run (1976),"Bored with the limited and tedious nature of provincial life in 19th-century France, the fierce and sensual Emma Bovary finds herself in calamitous debt and pursues scandalous sexual liaisons with absolute abandon. However, when her volatile lifestyle catches up to her, the lives of everyone around her are endangered."
1587,Conan the Barbarian (1982),"Gilbert Grape is a small-town young man with a lot of responsibility. Chief among his concerns are his mother, who is so overweight that she can't leave the house, and his mentally impaired younger brother, Arnie, who has a knack for finding trouble. Settled into a job at a grocery store and an ongoing affair with local woman Betty Carver, Gilbert finally has his life shaken up by the free-spirited Becky."
3269,Forever Young (1992),No description available
3417,"Crimson Pirate, The (1952)","Fascinated by the idea of ​​being able to create life through science, a count produces a monster from corpses. Does the creature have a soul?"
3354,Mission to Mars (2000),No description available
1263,"Deer Hunter, The (1978)",
2572,10 Things I Hate About You (1999),No description available
2731,"400 Blows, The (Les Quatre cents coups) (1959)","Set in colonial French Indochina during the 1930s to 1950s, this is the story of Éliane Devries, a French plantation owner, and of her adopted Vietnamese daughter, Camille, set against the backdrop of the rising Vietnamese nationalist movement."
3033,Spaceballs (1987),"It's 1957, and James Whale's heyday as the director of ""Frankenstein,"" ""Bride of Frankenstein"" and ""The Invisible Man"" is long behind him. Retired and a semi-recluse, he lives his days accompanied only by images from his past. When his dour housekeeper, Hannah, hires a handsome young gardener, the flamboyant director and simple yard man develop an unlikely friendship, which will change them forever."
2243,Broadcast News (1987),No description available
2694,Big Daddy (1999),"Set in Inner Mongolia, a physical setback causes a young woman to choose a suitor who can take care of her, as well as her disabled husband."
2920,Children of Paradise (Les enfants du paradis) (1945),No description available
1982,Halloween (1978),No description available
2976,Bringing Out the Dead (1999),"Pleasantly plump teenager Tracy Turnblad auditions to be on Baltimore's most popular dance show - The Corny Collins Show - and lands a prime spot. Through her newfound fame, she becomes determined to help her friends and end the racial segregation that has been a staple of the show."
2485,She's All That (1999),No description available
141,"Birdcage, The (1996)","After narrowly escaping a bizarre accident, a troubled teenager is plagued by visions of a large bunny rabbit that manipulates him to commit a series of crimes."
3798,What Lies Beneath (2000),No description available
2707,Arlington Road (1999),A biblical epic from the Book of Acts and Paul's epistles covering his conversion from Saul of Tarsus to his ministry to the Gentiles.
2567,EDtv (1999),"A biopic depicting the life of filmmaker and aviation pioneer Howard Hughes from 1927 to 1947, during which time he became a successful film producer and an aviation magnate, while simultaneously growing more unstable due to severe obsessive-compulsive disorder."
3004,"Bachelor, The (1999)","Mario, a young philanderer, receives 13 antique chairs in a bad state by inheritance and decides to sell off them to get some money. Afterwards he gets to know that one of them contains documents worth a lot of money. So he begins an adventurous trip to regain possession of the chair. On the way he meets many strange people who would like to help or to swindle him."
3005,"Bone Collector, The (1999)",No description available
2719,"Haunting, The (1999)","When Pharaoh Rameses II begins to tighten the noose on his Jewish slaves, Israelite Moses, called upon by God, leads his people to freedom."
160,Congo (1995),"Likely in June 1897, a group of people are standing along the platform of a railway station in La Ciotat, waiting for a train. One is seen coming, at some distance, and eventually stops at the platform. Doors of the railway-cars open and attendants help passengers off and on.  Popular legend has it that, when this film was shown, the first-night audience fled the café in terror, fearing being run over by the ""approaching"" train. This legend has since been identified as promotional embellishment, though there is evidence to suggest that people were astounded at the capabilities of the Lumières' cinématographe."
748,"Arrival, The (1996)",No description available
2724,Runaway Bride (1999),No description available
2581,Never Been Kissed (1999),No description available
1783,Palmetto (1998),"Based on a real-life story, this drama focuses on a small group of Allied soldiers in Burma who are held captive by the Japanese. Capt. Ernest Gordon (Ciaran McMenamin), Lt. Jim Reardon (Kiefer Sutherland) and Maj. Ian Campbell (Robert Carlyle) are among the military officers kept imprisoned and routinely beaten and deprived of food. While Campbell wants to rebel and attempt an escape, Gordon tries to take a more stoic approach, an attitude that proves to be surprisingly resonant."
1422,Murder at 1600 (1997),"To take down South Boston's Irish Mafia, the police send in one of their own to infiltrate the underworld, not realizing the syndicate has done likewise. While an undercover cop curries favor with the mob kingpin, a career criminal rises through the police ranks. But both sides soon discover there's a mole among them."
3461,Lord of the Flies (1963),No description available
3535,American Psycho (2000),No description available
257,Just Cause (1995),"Oliver Twist the modern filmed version of Charles Dickens bestseller, a Roman Polanski adaptation. The classic Dickens tale, where an orphan meets a pickpocket on the streets of London. From there, he joins a household of boys who are trained to steal for their master."
832,Ransom (1996),"In this classic German thriller, Hans Beckert, a serial killer who preys on children, becomes the focus of a massive Berlin police manhunt. Beckert's heinous crimes are so repellant and disruptive to city life that he is even targeted by others in the seedy underworld network. With both cops and criminals in pursuit, the murderer soon realizes that people are on his trail, sending him into a tense, panicked attempt to escape justice."
762,Striptease (1996),"King Arthur, accompanied by his squire, recruits his Knights of the Round Table, including Sir Bedevere the Wise, Sir Lancelot the Brave, Sir Robin the Not-Quite-So-Brave-As-Sir-Lancelot and Sir Galahad the Pure. On the way, Arthur battles the Black Knight who, despite having had all his limbs chopped off, insists he can still fight. They reach Camelot, but Arthur decides not  to enter, as ""it is a silly place""."
2676,Instinct (1999),No description available
1883,Bulworth (1998),"A tribute to the controversial black activist and leader of the struggle for black liberation. He hit bottom during his imprisonment in the '50s, he became a Black Muslim and then a leader in the Nation of Islam. His assassination in 1965 left a legacy of self-determination and racial pride."
2763,"Thomas Crown Affair, The (1999)",No description available
3566,"Big Kahuna, The (2000)",No description available
2764,"Thomas Crown Affair, The (1968)","Seven young men who played soccer together since their early youth grow apart and are forced to think about the nature of their friendship. In a comic way and a very Dutch setting, All Stars is about pregnant girlfriends and homosexuality, career plans and the power of parents."
1892,"Perfect Murder, A (1998)","Luke Skywalker leads a mission to rescue his friend Han Solo from the clutches of Jabba the Hutt, while the Emperor seeks to destroy the Rebellion once and for all with a second dreaded Death Star."
1608,Air Force One (1997),"Jimmy Muir comes from a typical gritty, northern town where there are only two options: working down the pit or in a factory. But Jimmy has other ideas - he dreams of becoming a professional footballer. Confronted by a bitter and unsupportive father, hard drinking friends and a lifetime of bad habits...has Jimmy the will to achieve his ultimate goal?"
1396,Sneakers (1992),"A dying man in his forties recalls his childhood, his mother, the war and personal moments that tell of and juxtapose pivotal moments in Soviet history with daily life."
2840,Stigmata (1999),"A postman in a small mountain village finds a woman and her son both dead in the ""grotte aux loups"" (cave of wolves). He soon begins to realize than it's not natural death, and that someone in the village in behind their murder, while tragic events occur."
2841,Stir of Echoes (1999),"Young Frenchwoman Mathilde searches for the truth about her missing fiancé, lost during World War I, and learns many unexpected things along the way. The love of her life is gone. But she refuses to believe he's gone forever — and she needs to know for sure."
3646,Big Momma's House (2000),No description available
500,Mrs. Doubtfire (1993),"A botched robbery indicates a police informant, and the pressure mounts in the aftermath at a warehouse. Crime begets violence as the survivors -- veteran Mr. White, newcomer Mr. Orange, psychopathic parolee Mr. Blonde, bickering weasel Mr. Pink and Nice Guy Eddie -- unravel."
3145,"Cradle Will Rock, The (1999)",Young Victor Frankenstein returns from medical school with a depraved taste for beautiful women and fiendish experiments.
2272,One True Thing (1998),No description available
2273,Rush Hour (1998),No description available
1619,Seven Years in Tibet (1997),Two criminal drifters without sympathy get more than they bargained for after kidnapping and holding for ransom the surrogate mother of a powerful and shady man.
1625,"Game, The (1997)",No description available
1487,Selena (1997),"In the final days of World War II, the Nazis attempt to use black magic to aid their dying cause. The Allies raid the camp where the ceremony is taking place, but not before they summon a baby demon who is rescued by Allied forces and dubbed ""Hellboy"". Sixty years later, Hellboy serves the cause of good rather than evil as an agent in the Bureau of Paranormal Research & Defense, along with Abe Sapien - a merman with psychic powers, and Liz Sherman - a woman with pyrokinesis, protecting America against dark forces."
1702,Flubber (1997),"Chaank Armaments is experimenting with the ultimate fighting machine which is part human - part machine. So far, the Hardman project has been unreliable and has killed a number of innocent people. The genius behind this project is Jack who lives in a world of models, toys and magazines. When he is fired by Cale for killing a few corporate officers, he unleashes the ultimate killing machine called the 'Warbeast' against Cale and those who would help her."
2433,"Civil Action, A (1998)","Delphine and Solange are two sisters living in Rochefort. Delphine is a dancing teacher and Solange composes and teaches the piano. Maxence is a poetand a painter. He is doing his military service. Simon owns a music shop, he left Paris one month ago to come back where he fell in love 10 years ago. They are looking for love, looking for each other, without being aware that their ideal partner is very close..."
70,From Dusk Till Dawn (1996),"Despondent over a painful estrangement from his daughter, trainer Frankie Dunn isn't prepared for boxer Maggie Fitzgerald to enter his life. But Maggie's determined to go pro and to convince Dunn and his cohort to help her."
1644,I Know What You Did Last Summer (1997),The boyfriend of an abducted woman never gives up the search as the abductor looks on.
1645,"Devil's Advocate, The (1997)","A young lawyer defends a black man accused of murdering two white men who raped his 10-year-old daughter, sparking a rebirth of the KKK."
2882,Jakob the Liar (1999),"When Camille falls ill, she is forced to live with Philibert and Franck."
2387,Very Bad Things (1998),"Handsome Jules has problems with school and girls. His domineering dad doesn't make matters easier, although his mom is supportive of her only child. Contemplating an extramarital affair, Claude Jade attempts to discreetly shop for condoms, a cute twist on what is traditionally a teenage boy's awkward ordeal."
2389,Psycho (1998),"Edmond Dantès, who was active in the resistance against the Nazis, is accused for being a Nazi collaborator and is imprisoned in the fortress of Sisteron."
2961,"Story of Us, The (1999)","For a long time the homunculus had to hide from his pursuers. But now he mingles with humanity again and sows discord, strife and murder. One day, when he meets an orphaned girl, he takes her to the shepherd Rudolf's parents. His goal is to pair the two together in order to breed a new human race from them. To this end, he kidnaps her to a deserted island. But the plan fails because Rudolf tries to kill the homunculus after learning his true identity. In revenge, the homunculus destroys the entire island, including the young couple. His hitherto loyal companion Edgar Rodin is so horrified by this deed that he renounces the homunculus and threatens him with death."
553,Tombstone (1993),"When a beautiful young Grace arrives in the isolated township of Dogville, the small community agrees to hide her from a gang of ruthless gangsters, and, in return, Grave agrees to do odd jobs for the townspeople."
628,Primal Fear (1996),"A vampire relates his epic life story of love, betrayal, loneliness, and dark hunger to an over-curious reporter."
3261,Singles (1992),No description available
2605,Entrapment (1999),"After a lightning bolt zaps a robot named Number 5, the lovable machine starts to think he's human and escapes the lab. Hot on his trail is his designer, Newton, who hopes to get to Number 5 before the military does. In the meantime, a spunky animal lover mistakes the robot for an alien and takes him in, teaching her new guest about life on Earth."
1804,"Newton Boys, The (1998)",No description available
1805,Wild Things (1998),No description available
2391,"Simple Plan, A (1998)","During a televised debate on the Algerian war in the early 1980s, Professor Paulet denounced the methods of Captain Caron, killed in action in 1957. The widow of the captain, Patricia, decided to file a defamation suit."
2394,"Prince of Egypt, The (1998)","Young Remi, a foundling, lives on the farm run by his impoverished foster parents. When their money runs out, unbeknown to his foster-mother, Rémi is sold by his hard-hearted foster father to an old street performer named Vitalis. Vitalis was once a famous opera singer, but became destitute after a tragic love affair."
3773,House Party (1990),No description available
1092,Basic Instinct (1992),"In postwar Vienna, Austria, Holly Martins, a writer of pulp Westerns, arrives penniless as a guest of his childhood chum Harry Lime, only to learn he has died. Martins develops a conspiracy theory after learning of a ""third man"" present at the time of Harry's death, running into interference from British officer Major Calloway, and falling head-over-heels for Harry's grief-stricken lover, Anna."
1672,"Rainmaker, The (1997)","French secret service agent Josselin Beaumont is dispatched to take down African warlord N'Jala. But when his assignment is canceled, he's shocked to learn that his government is surrendering him to local authorities. He is given a mock trial and sentenced to 20 years of hard labor. But Beaumont escapes from prison and vows not only to avenge himself against his betrayers but also to finish his original assignment."
2555,Baby Geniuses (1999),No description available
2629,"Love Letter, The (1999)",No description available
2701,Wild Wild West (1999),"Rather than choosing a great leader or king, God chooses Abraham, an elderly shepherd from Mesopotamia, as the way to establish his Covenant with mankind... A man of great faith, Abraham continues to believe in God even when He seems to have abandoned him."
2568,"Mod Squad, The (1999)",No description available
2713,Lake Placid (1999),No description available
1911,Doctor Dolittle (1998),"A Muslim ambassador exiled from his homeland, Ahmad ibn Fadlan finds himself in the company of Vikings. While the behavior of the Norsemen initially offends ibn Fadlan, the more cultured outsider grows to respect the tough, if uncouth, warriors. During their travels together, ibn Fadlan and the Vikings get word of an evil presence closing in, and they must fight the frightening and formidable force, which was previously thought to exist only in legend."
3516,"Bell, Book and Candle (1958)",
2643,Superman IV: The Quest for Peace (1987),No description available
2720,Inspector Gadget (1999),No description available
2722,Deep Blue Sea (1999),"When Paula leaves her mate Pedro, he misses her and looks for comfort with his best friends, Javier and Sonia. Paula is having an affair with Javier. Pedro tries to find who is the secret lover of Paula, and hires a private eye. Meanwhile, while comforting Pedro, Sonia has a one night stand with him and Javier thinks she is cheating on him with her lesbian friend Luzia."
2805,Mickey Blue Eyes (1999),"A homage and parody of 1950s and 1960s Thai romantic melodramas and action films.  Dum, the son of a peasant falls in love with Rumpoey, the daughter of a wealthy and respected family. The star-crossed lovers are torn apart for years, but their forbidden love survives.  When tragedy strikes, Dum unleashes his rage and becomes the gun-slinging outlaw the ""Black Tiger"" who will stop at nothing to seek his revenge."
2828,Dudley Do-Right (1999),No description available
2761,"Iron Giant, The (1999)","After three British agents are assigned to assassinate a mysterious German spy during World War I, two of them become ambivalent when their duty to the mission conflicts with their consciences."
2856,I Saw What You Did (1965),An alcoholic married man discovers he has fallen out of love with his moody wife.
2369,Desperately Seeking Susan (1985),No description available
2888,Drive Me Crazy (1999),No description available
2392,Jack Frost (1998),"Sandro, a detective, finds his wife strangled. His girl-friend Tiffany, who works as photographer, makes a ""Blow up"" from a photo, what Sandro finds beside the victim. Sandro and Tiffany are looking for the woman on the photo, Laura. They finds her in a Night Club in Rome..."
2975,"Best Man, The (1999)",No description available
1179,"Grifters, The (1990)",No description available
2553,Village of the Damned (1960),No description available
2554,Children of the Damned (1963),No description available
3932,"Invisible Man, The (1933)",No description available
3863,"Cell, The (2000)",No description available
1185,My Left Foot (1989),No description available
3503,Solaris (Solyaris) (1972),No description available
3879,"Art of War, The (2000)",No description available
3375,Destination Moon (1950),No description available
1779,Sphere (1998),"A documentary about the closure of General Motors' plant at Flint, Michigan, which resulted in the loss of 30,000 jobs. Details the attempts of filmmaker Michael Moore to get an interview with GM CEO Roger Smith."
164,Devil in a Blue Dress (1995),"Holly Golightly is an eccentric New York City playgirl determined to marry a Brazilian millionaire. But when young writer Paul Varjak moves into her apartment building, her past threatens to get in their way."
3457,Waking the Dead (1999),No description available
319,Shallow Grave (1994),"Clarence marries hooker Alabama, steals cocaine from her pimp, and tries to sell it in Hollywood, while the owners of the coke try to reclaim it."
247,Heavenly Creatures (1994),"Career criminal Johnny Clay recruits a sharpshooter, a crooked police officer, a bartender and a betting teller named George, among others, for one last job before he goes straight and gets married. But when George tells his restless wife about the scheme to steal millions from the racetrack where he works, she hatches a plot of her own."
1428,Angel Baby (1995),"A CIA agent hires hitman ""El Mariachi"" to assassinate a Mexican general hired by a drug kingpin attempting a coup d'état."
1284,"Big Sleep, The (1946)",For this second film in the cult comedy series Torrente takes our fat police officer from Madrid to Marbella in Spain to investigate a villain’s plot to destroy the city with a missile. This James Bond style slapstick comedy became the most successful box-office film in Spanish film history beating out only the first Torrente film.
2660,"Thing From Another World, The (1951)",No description available
2661,It Came from Outer Space (1953),The Dynamic Duo faces four super-villains who plan to hold the world for ransom with the help of a secret invention that instantly dehydrates people.
2663,It Came from Beneath the Sea (1955),No description available
2664,Invasion of the Body Snatchers (1956),No description available
2667,"Mole People, The (1956)","In October of 1994 three student filmmakers disappeared in the woods near Burkittsville, Maryland, while shooting a documentary. A year later their footage was found."
2668,Swamp Thing (1982),"The curse of The Headless Horseman (Christopher Walken) is the legacy of the small town of Sleepy Hollow. Spearheaded by the eager Constable Ichabod Crane (Johnny Depp) and his new-world ways into the quagmire of secrets and murder, secrets once laid to rest, best forgotten, and now reawakened, and he too, holding a dark secret of a past once gone."
3032,"Omega Man, The (1971)","While a group of Special Forces train a village to defend itself against Terrorists, the Captain of the group locks horns with the resident America Nun, who seems to be slightly better at everything that he is good at."
2311,2010 (1984),
2173,"Navigator: A Mediaeval Odyssey, The (1988)","A man and his buddies learn to deal with love, sex, and passing gas."
198,Strange Days (1995),"During the Nazi occupation of Poland, an acting troupe becomes embroiled in a Polish soldier's efforts to track down a German spy."
2752,Outrageous Fortune (1987),"Matt Sullivan's last big relationship ended in disaster and ever since his heart's been aching and his commitment's been lacking. Then came Lent, that time of year when everybody gives something up. That's when Matt decides to go where no man's gone before and make a vow: No sex. Whatsoever. For 40 straight days. At first he has everything under control. That is until the woman of his dreams, Erica, walks into his life."
340,"War, The (1994)","A young Jewish American man endeavors—with the help of eccentric, distant relatives—to find the woman who saved his grandfather during World War II—in a Ukrainian village which was ultimately razed by the Nazis."
3700,"Brother from Another Planet, The (1984)","A notoriously harsh French judge, vacationing at a luxury resort, finds his holiday interrupted when a mysterious killer begins murdering those in and around the hotel."
2901,Phantasm (1979),
3638,Moonraker (1979),"Master chef Kate Armstrong runs her life and her kitchen with intimidating intensity. However, a recipe for disaster may be in the works when she becomes the guardian of her young niece while crossing forks with the brash sous-chef who just joined her staff. Though romance blooms in the face of rivalry, Kate needs to look outside the kitchen to find true happiness."
30,Shanghai Triad (Yao a yao yao dao waipo qiao) (1995),No description available
1601,Hoodlum (1997),No description available
3713,"Long Walk Home, The (1990)",No description available
2912,"Limey, The (1999)","An unlikely friendship between a dour, working class butcher and a repressed schoolteacher coincides with a grisly series of Ripper-type murders in a provincial French town."
3576,"Hidden, The (1987)",Dr. Kildare's friend Dr. Gillespie is called in to investigate when a young man suffering from mental problems disappears on a killing spree.
503,"New Age, The (1994)","A packed cruise ship traveling the Atlantic is hit and overturned by a massive wave, compelling the passengers to begin a dramatic fight for their lives."
