movie_id,title,description
483,King of the Hill (1993),"After serving prison time for a self-defense killing, Sailor Ripley reunites with girlfriend Lula Fortune. Lula's mother, Marietta, desperate to keep them apart, hires a hitman to kill Sailor. But he finds a whole new set of troubles when he and Bobby Peru, an old buddy who's also out to get Sailor, try to rob a store. When Sailor lands in jail yet again, the young lovers appear further than ever from the shared life they covet."
3839,Phantasm IV: Oblivion (1998),No description available
409,Above the Rim (1994),"In the 1930s, Count Almásy is a Hungarian map maker employed by the Royal Geographical Society to chart the vast expanses of the Sahara Desert along with several other prominent explorers. As World War II unfolds, Almásy enters into a world of love, betrayal, and politics."
1062,"Sunchaser, The (1996)",No description available
3886,Steal This Movie! (2000),No description available
761,"Phantom, The (1996)","Charles Duchemin, a well-known gourmet and publisher of a famous restaurant guide, is waging a war against fast food entrepreneur Tri- catel to save the French art of cooking. After having agreed to appear on a talk show to show his skills in naming food and wine by taste, he is confronted with two disasters: his son wants to become a clown rather than a restaurant tester and he, the famous Charles Duchemin, has lost his taste!"
1626,Fire Down Below (1997),Twelve episodic tales in the life of a Parisian woman and her slow descent into prostitution.
2614,Chopping Mall (a.k.a. Killbots) (1986),"Test pilot Tuck Pendleton volunteers to test a special vessel for a miniaturization experiment. Accidentally injected into a neurotic hypochondriac, Jack Putter, Tuck must convince Jack to find his ex-girlfriend, Lydia Maxwell, to help him extract Tuck and his ship and re-enlarge them before his oxygen runs out."
504,No Escape (1994),"An emotionally scarred highway drifter shoots a sadistic trick who rapes her, and ultimately becomes America's first female serial killer."
3810,White Sands (1992),No description available
547,Surviving the Game (1994),The mother of a severely traumatized daughter enlists the aid of a unique horse trainer to help the girl's equally injured horse.
2894,Romance (1999),"Grace Dalrymple Elliot is a British aristocrat trapped in Paris during the French Revolution. Determined to maintain her stiff upper lip and pampered life despite the upheaval, Grace continues her friendship with the Duke of Orléans while risking her life and liberty to protect a fugitive."
776,Babyfever (1994),A weekend at a marquis’ country château lays bare some ugly truths about a group of haut bourgeois acquaintances.
137,Man of the Year (1995),"A narcissistic TV weatherman, along with his attractive-but-distant producer, and his mawkish cameraman, is sent to report on Groundhog Day in the small town of Punxsutawney, where he finds himself repeating the same day over and over."
3909,Woman on Top (2000),No description available
747,"Stupids, The (1996)","Shaun lives a supremely uneventful life, which revolves around his girlfriend, his mother, and, above all, his local pub. This gentle routine is threatened when the dead return to life and make strenuous attempts to snack on ordinary Londoners."
717,Mouth to Mouth (Boca a boca) (1995),No description available
3867,All the Rage (a.k.a. It's the Rage) (1999),Four nights in Caracas. A documentary essay about chaos and civilization.
3796,"Wisdom of Crocodiles, The (a.k.a. Immortality) (2000)",No description available
725,"Great White Hype, The (1996)",No description available
3031,Repossessed (1990),"An obsessed scientist conducts profane experiments in evolution, eventually establishing himself as the self-styled demigod to a race of mutated, half-human abominations."
2305,Slam (1998),No description available
1503,8 Heads in a Duffel Bag (1997),No description available
767,"Grass Harp, The (1995)","As Lord Voldemort tightens his grip on both the Muggle and wizarding worlds, Hogwarts is no longer a safe haven. Harry suspects perils may even lie within the castle, but Dumbledore is more intent upon preparing him for the final battle fast approaching. Together they work to find the key to unlock Voldemorts defenses and to this end, Dumbledore recruits his old friend and colleague Horace Slughorn, whom he believes holds crucial information. Even as the decisive showdown looms, romance blossoms for Harry, Ron, Hermione and their classmates. Love is in the air, but danger lies ahead and Hogwarts may never be the same again."
774,Wend Kuuni (God's Gift) (1982),"Working men and women leave through the main gate of the Lumière factory in Lyon, France. Filmed on 22 March 1895, it is often referred to as the first real motion picture ever made, although Louis Le Prince's 1888 Roundhay Garden Scene pre-dated it by seven years.  Three separate versions of this film exist, which differ from one another in numerous ways. The first version features a carriage drawn by one horse, while in the second version the carriage is drawn by two horses, and there is no carriage at all in the third version. The clothing style is also different between the three versions, demonstrating the different seasons in which each was filmed. This film was made in the 35 mm format with an aspect ratio of 1.33:1, and at a speed of 16 frames per second. At that rate, the 17 meters of film length provided a duration of 46 seconds, holding a total of 800 frames."
2425,"General, The (1998)",No description available
3158,"Emperor and the Assassin, The (Jing ke ci qin wang) (1999)",No description available
3245,I Am Cuba (Soy Cuba/Ya Kuba) (1964),No description available
3181,Titus (1999),No description available
2602,Mighty Peking Man (Hsing hsing wang) (1977),No description available
1741,"Midaq Alley (Callejón de los milagros, El) (1995)",No description available
2624,After Life (1998),No description available
2483,"Day of the Beast, The (El Día de la bestia) (1995)",No description available
1844,Live Flesh (1997),"Two thieves, who travel in elegant circles, try to outsmart each other and, in the process, end up falling in love."
3459,Gothic (1986),No description available
2585,"Lovers of the Arctic Circle, The (Los Amantes del Círculo Polar) (1998)",No description available
3532,Freedom for Us (À nous la liberté ) (1931),No description available
1867,Tarzan and the Lost City (1998),No description available
1795,"Callejón de los milagros, El (1995)",No description available
1796,In God's Hands (1998),No description available
1891,"Ugly, The (1997)","The epic saga continues as Luke Skywalker, in hopes of defeating the evil Galactic Empire, learns the ways of the Jedi from aging master Yoda. But Darth Vader is more determined than ever to capture Luke. Meanwhile, rebel leader Princess Leia, cocky Han Solo, Chewbacca, and droids C-3PO and R2-D2 are thrown into various stages of capture, betrayal and despair."
2768,Stiff Upper Lips (1998),"Julian makes a lucrative living as an escort to older women in the Los Angeles area. He begins a relationship with Michelle, a local politician's wife, without expecting any pay. One of his clients is murdered and Detective Sunday begins pumping him for details on his different clients, something he is reluctant to do considering the nature of his work. Julian begins to suspect he's being framed. Meanwhile Michelle begins to fall in love with him."
2844,"Minus Man, The (1999)","In the spring of 1913, Parisian businessman Gabriel Astruc opens a new theater on the Champs Elysées. The first performance is the premiere of Igor Stravinsky's 'The Rite of Spring', danced by the Ballet Russes. The rehearsal process is extremely fraught: the orchestra dislike Stravinsky's harsh, atonal music; the dancers dislike the 'ugly' choreography of Vaslav Nijinsky. The volatile, bisexual Nijinsky is in a strained relationship with the much older Sergei Diaghilev, the Ballet Russes' charismatic but manipulative impresario. Public expectation is extremely high after Nijinsky's success in 'L'apres-midi d'un faune'. Finally, 'The Rite of Spring' premieres to a gossip-loving, febrile, fashion-conscious Parisian audience sharply divided as to its merits."
1105,Children of the Corn IV: The Gathering (1996),No description available
1058,Bitter Sugar (Azucar Amargo) (1996),"Jesse, a small-time criminal, high-tails it to Los Angeles to rendezvous with a French exchange student. Stealing a car and accidentally killing a highway patrolman, he becomes the most wanted fugitive in L.A."
525,"Saint of Fort Washington, The (1993)","Jake Blues, just released from prison, puts his old band back together to save the Catholic home where he and his brother Elwood were raised."
67,Two Bits (1995),Two childhood friends are recruited for a suicide bombing in Tel Aviv.
80,"White Balloon, The (Badkonake Sefid ) (1995)","Nine years later, Jesse travels across Europe giving readings from a book he wrote about the night he spent in Vienna with Celine. After his reading in Paris, Celine finds him, and they spend part of the day together before Jesse has to again leave for a flight. They are both in relationships now, and Jesse has a son, but as their strong feelings for each other start to return, both confess a longing for more."
3902,Goya in Bordeaux (Goya en Bodeos) (1999),"Six actors portray six personas of music legend Bob Dylan in scenes depicting various stages of his life, chronicling his rise from unknown folksinger to international icon and revealing how Dylan constantly reinvented himself."
488,M. Butterfly (1993),"At the start of the First World War, in the middle of Africa’s nowhere, a gin soaked riverboat captain is persuaded by a strong-willed missionary to go down river and face-off a German warship."
632,Land and Freedom (Tierra y libertad) (1995),"It's a dreary Christmas 1944 for the American POWs in Stalag 17 and the men in Barracks 4, all sergeants, have to deal with a grave problem—there seems to be a security leak."
635,"Family Thing, A (1996)","A down-and-out Brooklyn detective is hired to track down a singer on an odyssey that will take him through the desperate streets of Harlem, the smoke-filled jazz clubs of New Orleans, and the swamps of Louisiana and its seedy underworld of voodoo."
495,In the Realm of the Senses (Ai no corrida) (1976),No description available
1646,Rocket Man (1997),"A young teacher inspires her class of at-risk students to learn tolerance, apply themselves, and pursue education beyond high school."
1550,Trial and Error (1997),"Quirky and rebellious April Burns lives with her boyfriend in a low-rent New York City apartment miles away from her emotionally distant family. But when she discovers that her mother has a fatal form of breast cancer, she invites the clan to her place for Thanksgiving. While her father struggles to drive her family into the city, April -- an inexperienced cook -- runs into kitchen trouble and must ask a neighbor for help."
2445,At First Sight (1999),No description available
27,Now and Then (1995),"Matt, a young glaciologist, soars across the vast, silent, icebound immensities of the South Pole as he recalls his love affair with Lisa. They meet at a mobbed rock concert in a vast music hall - London's Brixton Academy. They are in bed at night's end. Together, over a period of several months, they pursue a mutual sexual passion whose inevitable stages unfold in counterpoint to nine live-concert songs."
295,"Pyromaniac's Love Story, A (1995)",No description available
3761,"Blood In, Blood Out (a.k.a. Bound by Honor) (1993)",No description available
3162,Simpatico (1999),"Eddie is a Vietnam veteran who loses his arms and legs when he steps on a land mine, but a brilliant surgeon is able to attach new limbs. Unfortunately an insanely jealous assistant (who has fallen in love with Eddie's fiance) switches Eddie's DNA injections, transforming him into a gigantic killer."
1874,Still Breathing (1997),The true story of a white South African racist whose life was profoundly altered by the black prisoner he guarded for twenty years. The prisoner's name was Nelson Mandela.
2865,Sugar Town (1999),No description available
1346,Cat People (1982),No description available
3180,Play it to the Bone (1999),No description available
1746,Senseless (1998),No description available
2651,Frankenstein Meets the Wolf Man (1943),No description available
1854,Kissing a Fool (1998),The charm of the beautiful Jonny is of a frightening effectiveness on the women. He uses it to create his company which offers his talents to lonely ladies. His business is going great and he is getting rich. But will Jonny be able to provide quality services for a long time?
174,Jury Duty (1995),"After years of war, the Federation and the Klingon empire find themselves on the brink of a peace summit when a Klingon ship is nearly destroyed by an apparent attack from the Enterprise. Both worlds brace for what may be their deadliest encounter."
191,"Scarlet Letter, The (1995)",Clara and Hans are left-wing terrorists who have been sought by police for almost fifteen years. Their increasingly rebellious daughter Jeanne begins to pose a threat to their security when she falls in love with a boy she meets on the beach.
414,"Air Up There, The (1994)",Batman must battle a disfigured district attorney and a disgruntled former employee with help from an amorous psychologist and a young circus acrobat.
354,Cobb (1994),No description available
430,Calendar Girl (1993),"C.R. MacNamara is a managing director for Coca Cola in West Berlin during the Cold War, just before the Wall is put up. When Scarlett, the rebellious daughter of his boss, comes to West Berlin, MacNamara has to look after her, but this turns out to be a difficult task when she reveals to be married to a communist."
433,Clean Slate (1994),"Mr Banks is looking for a nanny for his two mischievous children and comes across Mary Poppins, an angelic nanny. She not only brings a change in their lives but also spreads happiness."
2889,"Mystery, Alaska (1999)",No description available
710,Celtic Pride (1996),"When a powerful satellite system falls into the hands of Alec Trevelyan, AKA Agent 006, a former ally-turned-enemy, only James Bond can save the world from a dangerous space weapon that -- in one short pulse -- could destroy the earth! As Bond squares off against his former compatriot, he also battles Xenia Onatopp, an assassin who uses pleasure as her ultimate weapon"
1642,Indian Summer (a.k.a. Alive & Kicking) (1996),"Angela Bennett is a freelance software engineer who lives in a world of computer technology. When a cyber friend asks Bennett to debug a new game, she inadvertently becomes involved in a conspiracy that will soon turn her life upside down and make her the target of an assassination."
2589,Friends & Lovers (1999),No description available
2695,"Boys, The (1997)",No description available
3945,Digimon: The Movie (2000),No description available
2307,One Tough Cop (1998),"A pastry boy and the son of a hair-piece mogul become involved in an arson scandal. Sergio is offered a bribe in exchange for taking the blame for the fire that destroys his workplace. Garet, the real arsonist, is apalled that someone else would try to take credit for his act of love. Before long, Sergio and Garet become entangled in a zany love-quadrangle involving Hattie and Stephanie. Written by Brian Whiting"
3165,Boiling Point (1993),"A hot air balloon crew and a dog find themselves on an island with scantily-clad part-alien women, zombies, and other monsters."
3653,"Endless Summer, The (1966)",No description available
2129,"Saltmen of Tibet, The (1997)",No description available
3947,Get Carter (1971),No description available
149,Amateur (1994),A secret military project endangers Neo-Tokyo when it turns a biker gang member into a rampaging psychic psychopath that only two teenagers and a group of psychics can stop.
3149,Diamonds (1999),"Dr. Frankenstein's Granddaughter Maria, and her brother assistant Rudolph, moved to the old west because the lightning storms there are more frequent and intense, which allows them to work on the experiments of their grandfather. But the experiments are failing and Rudolph's been secretly killing the corpses afterwards. Meanwhile, the Lopez family leaves the town because of the evil going on there"
2785,Tales of Terror (1962),No description available
1427,Turbulence (1997),"Jean-Baptiste Grenouille, born in the stench of 18th century Paris, develops a superior olfactory sense, which he uses to create the world's finest perfumes. However, his work takes a dark turn as he tries to preserve scents in the search for the ultimate perfume."
917,"Little Princess, The (1939)","A poverty-stricken woman raises her sons through many trials and tribulations. But no matter the struggles, always sticks to her own moral code."
1523,"Truth or Consequences, N.M. (1997)","Young Scottish doctor, Nicholas Garrigan decides it's time for an adventure after he finishes his formal education, so he decides to try his luck in Uganda, and arrives during the downfall of President Obote. General Idi Amin comes to power and asks Garrigan to become his personal doctor."
1531,Losing Chase (1996),No description available
2999,Man of the Century (1999),No description available
1410,"Evening Star, The (1996)","A group of scientists are sent on a mission to destroy unstable planets. Twenty years into their mission, they have to battle their alien mascot as well as a ""sensitive"" and intelligent bombing device that starts to question the meaning of its existence."
2809,Love Stinks (1999),No description available
1317,I'm Not Rappaport (1996),No description available
2051,Herbie Goes to Monte Carlo (1977),No description available
2151,"Gods Must Be Crazy II, The (1989)",The brains of a Russian taxi driver and a wealthy businessman are brought together in one body by a mad scientist.
3042,Meatballs III (1987),"In the early 19th century, Dr. Frankenstein discovers the secret of life – how to create a perfect man – powerful, intelligent and immune to disease. But something goes wrong in the laboratory and the doctor’s hideous creation disappears into the night. At first, Frankenstein hoped that the horrible monster would perish in the wilderness, but now he senses that it’s alive and sets out for him. Dr. Frankenstein tracks the creature to the Arctic, where the two must battle to decide who will become the master of the other’s life…or death."
3043,Meatballs 4 (1992),"Within the decadent walls of the Frankenstein mansion, the Baron and his depraved assistant Otto have discovered the means of creating new life. As the Baron's laboratory begins to fill up with stitched body parts, the Baroness dallies with the randy new manservant and soon the decadent, permissive household is consumed by an outrageous, bizarre and hilarious combination of death and dismemberment."
3048,Under the Rainbow (1981),This film tries to blow the whistle on what it calls the biggest swindle in modern history: 'Man Made Global Warming'. Watch this film and make up your own mind.
2345,Desert Bloom (1986),No description available
2286,"Fiendish Plot of Dr. Fu Manchu, The (1980)","Dolf a 15 year old boy is sent back in time by a timemachine. Accidentally he is sent back to the Middle Ages. He is rescued by children who are part of a childrens' crusade, on their way to rescue Jeruzalem. During the trip Dolf finds out the danger is not coming from outside the crusade, but from within."
3161,Onegin (1999),"Via reminiscences from writer/actor Gene Wilder and others, this documentary recalls the making of the 1974 film Young Frankenstein."
964,Angel and the Badman (1947),The deformed Phantom who haunts the Paris Opera House causes murder and mayhem in an attempt to make the woman he loves a star.
102,Mr. Wrong (1996),"Cecilie and Joachim are about to get married when a freak car accident leaves Joachim disabled, throwing their lives into a spin. The driver of the other car, Marie, and her family don’t get off lightly, either. Her husband Niels works in the hospital where he meets Cecilie and falls madly in love with her."
119,"Steal Big, Steal Little (1995)",No description available
131,Frankie Starlight (1995),No description available
3427,Coogan's Bluff (1968),"Max is a Paris detective, aloof, independently wealthy, and frustrated by gangs of robbers whom he cannot catch. To re-establish his stature and save face, he decides to inveigle a group of petty thieves (led by an old acquaintance) to rob a bank. A reluctant captain provides Max intelligence and Max starts spending evenings with Lilly, a prostitute who's the girlfriend of the group's leader. He poses as a rich banker with money to burn and encourages Lilly to think about her future. He hints at a payroll that comes through his bank. The plot works, the petty thieves think they're ready for a big score, and the cops are in place. What could go wrong with Max's cold plan? Who's entrapped?"
1839,My Giant (1998),"On her birthday, Juliette is too upset to worry about the strange cleaner who imitates her every move and lusts after her clothing."
1857,"Real Blonde, The (1997)","The Autobots must stop a colossal planet-consuming robot who goes after the Autobot Matrix of Leadership. At the same time, they must defend themselves against an all-out attack from the Decepticons."
1863,Major League: Back to the Minors (1998),"At the end of World War II, Giovanna, a war bride living near Milan refuses to accept that her husband, Antonio, missing on the Russian front, is dead. There's a flashback to their brief courtship near her hometown of Naples, his 12-day leave to marry her, ruses to keep from deployment, and the ultimate farewell. Some years after the war, still with no word from Antonio, Giovanna goes to Russia to find him, starting in the town near the winter battle when he disappeared. Armed with his photograph, what will she find?"
3622,"Twelve Chairs, The (1970)",No description available
2685,"Red Dwarf, The (Le Nain rouge) (1998)",No description available
3496,Madame Sousatzka (1988),No description available
505,North (1994),"A career criminal who has been deformed since birth is given a new face by a kindly doctor and paroled from prison. It appears that he has gone straight, but he is really planning his revenge on the man who killed his mentor and sent him to prison."
444,Even Cowgirls Get the Blues (1993),No description available
3804,H.O.T.S. (1979),No description available
537,Sirens (1994),"Jean-Claude Delsart, a 50 years-old bailiff, with his worn-out smile and heart, abandoned a long time ago the idea that life could give him pleasures. Until the day, he dares to push the doors of a tango lesson..."
3695,"Toxic Avenger Part III: The Last Temptation of Toxie, The (1989)","Stuntman Johnny gets tired of putting his life constantly at risk and instead joins up with a bunch of international thieves who are looking to steal a priceless statue, but that's where the trouble starts...."
2031,"$1,000,000 Duck (1971)","Young Prince Nechljudov is summoned as a judge in a murder trial. A rich merchant was found dead in the room of the inn where he was staying and the prostitute Maslova was accused of the crime. Nechljudov recognizes in the woman the maid of the aunts he had seduced and abandoned years before and tries to convince the authorities of her of his innocence but to no avail. Convinced that he is responsible for her moral fall, he follows her to Siberia where she must serve her sentence."
2032,"Barefoot Executive, The (1971)","A group of American pilots from Alaska ferry Airacobra fighter planes across the ocean on Lend-lease. The orderly course of life is disrupted when it becomes clear that the American pilots are attractive and charming young women. The feelings of the Russian young men collide into barriers of culture and language resulting in a host of awkward, funny, and sometimes tragic situations.It is the story of Russians, Americans, and natives of the Far North. It is the story of man and woman in war. Love and death are squeezed between the hills as human fates are destroyed and born."
2900,Monkey Shines (1988),"When astronaut Spencer Armacost returns to Earth after a mission that nearly cost him his life, he decides to take a desk job in order to see his beautiful wife, Jillian, more often. Gradually, Jillian notices that Spencer's personality seems to have changed, but her concerns fade when she discovers that she's pregnant. As Jillian grows closer to becoming a mother, her suspicions about Spencer return. Why does it seem as if he's a different person?"
1484,"Daytrippers, The (1996)","Fritz Haarmann, who has killed at least 27 boys, is questioned by a psychology professor in order to find out whether he is sane and can be held responsible for his crimes. During this interrogation Haarmann reveals his motives and his killing methods."
1076,"Innocents, The (1961)",No description available
570,"Slingshot, The (Kådisbellan ) (1993)","Anaïs is twelve and bears the weight of the world on her shoulders. She watches her older sister, Elena, whom she both loves and hates. Elena is fifteen and devilishly beautiful. Neither more futile, nor more stupid than her younger sister, she cannot understand that she is merely an object of desire. And, as such, she can only be taken. Or had. Indeed, this is the subject: a girl's loss of virginity. And, that summer, it opens a door to tragedy."
662,Fear (1996),A man is sent back and forth and in and out of time in an experiment that attempts to unravel the fate and the solution to the problems of a post-apocalyptic world during the aftermath of WW3. The experiment results in him getting caught up in a perpetual reminiscence of past events that are recreated on an airport’s viewing pier.
