movie_id,title,description
2097,Something Wicked This Way Comes (1983),"An expedition in the South Pacific lands on a tropical island where the natives worship the mysterious deity Gappa. An earthquake opens up an underground cavern and a baby reptile is discovered inside. The natives warn the foreigners to leave the hatching alone, but they don't listen and take it back to a zoo in Japan. Soon after, moma and papa Gappa start smashing Tokyo looking for their kidnapped child."
3612,"Slipper and the Rose, The (1976)",No description available
1952,Midnight Cowboy (1969),No description available
2846,"Adventures of Milo and Otis, The (1986)",
1983,Halloween II (1981),No description available
1984,Halloween III: Season of the Witch (1983),"In a totalitarian future society, a man whose daily work is rewriting history tries to rebel by falling in love."
1985,Halloween 4: The Return of Michael Myers (1988),"Justin Quayle is a low-level British diplomat who has always gone about his work very quietly, not causing any problems. But after his radical wife Tessa is killed he becomes determined to find out why, thrusting himself into the middle of a very dangerous conspiracy."
1986,Halloween 5: The Revenge of Michael Myers (1989),In 1980 the black Falashas in Ethiopia are recognised as genuine Jews and are secretly carried to Israel. The day before the transport the son of a Jewish mother dies. In his place and with his name (Schlomo) she takes a Christian 9-year-old boy.
891,Halloween: The Curse of Michael Myers (1995),"During the 1972 elections, two reporters' investigation sheds light on the controversial Watergate scandal that compels President Nixon to resign from his post."
107,Muppet Treasure Island (1996),"Unscrupulous boxing promoters, violent bookmakers, a Russian gangster, incompetent amateur robbers and supposedly Jewish jewelers fight to track down a priceless stolen diamond."
3251,Agnes of God (1985),No description available
2460,"Texas Chainsaw Massacre 2, The (1986)","Angel, an exterminator recently released from a mental hospital, comes to rid a small Spanish town of tiny grubs in the soil. The local wine-making industry has found these pests responsible for giving their product an ""earthy"" taste that has divided local opinion. While in town, Angel becomes involved with two beautiful and very different women, and impacts their lives on a grand scale. Can either of these women accept the fact that Angel travels with a ""ghost"" of himself, or that he routinely speaks with the deseased townspeople?"
2461,Leatherface: Texas Chainsaw Massacre III (1990),No description available
2462,"Return of the Texas Chainsaw Massacre, The (1994)","The frozen body of Paul Fournier is discovered in Greenland where he had disappeared during a scientific expedition in 1905. Perfectly conserved he is brought back to life in the 1960s. His descendants take care of him: to spare him the cultural shock they behave so to make believe it's 1905 and they are his cousins, uncle..."
3771,"Golden Voyage of Sinbad, The (1974)",No description available
2107,Halloween: H20 (1998),"With the help of a talking freeway billboard, a ""wacky weatherman"" tries to win the heart of an English newspaper reporter, who is struggling to make sense of the strange world of early-90s Los Angeles."
2110,Dead Men Don't Wear Plaid (1982),"Hubert is a French policeman with very sharp methods. After being forced to take 2 months off by his boss, who doesn't share his view on working methods, he goes back to Japan, where he used to work 19 years ago, to settle the probate of his girlfriend who left him shortly after marriage without a trace."
1821,"Object of My Affection, The (1998)",No description available
3284,They Might Be Giants (1971),No description available
140,Up Close and Personal (1996),"Two children, Ignacio and Enrique, know love, the movies and fear in a religious school at the beginning of the 1960s. Father Manolo, director of the school and its professor of literature, is witness to and part of these discoveries. The three are followed through the next few decades, their reunion marking life and death."
218,Boys on the Side (1995),"In the post-apocalyptic future, reigning tyrannical supercomputers teleport a cyborg assassin known as the ""Terminator"" back to 1984 to kill Sarah Connor, whose unborn son is destined to lead insurgents against 21st century mechanical hegemony. Meanwhile, the human-resistance movement dispatches a lone warrior to safeguard Sarah. Can he stop the virtually indestructible killing machine?"
3436,Dying Young (1991),No description available
2491,Simply Irresistible (1999),No description available
2492,20 Dates (1998),No description available
2205,Mr. & Mrs. Smith (1941),"In this wacky comedy, teen-aged Tony (Bentley C. Mitchum) has never known who is father is. Together with his best buddies Peter and Susan, he tracks down the clues he has as well as he can."
3873,Cat Ballou (1965),No description available
3874,"Couch in New York, A (1996)",No description available
1914,Smoke Signals (1998),
305,Ready to Wear (Pret-A-Porter) (1994),No description available
1414,Mother (1996),"Otto and Ana are kids when they meet each other. Their names are palindromes. They meet by chance, people are related by chance. A story of circular lives, with circular names, and a circular place where the day never ends in the midnight sun. There are things that never end, and Love is one of them."
1782,Little City (1998),"Newly divorced lawyer Nathan Del Amico is shaken up after he meets a doctor who claims that he can sense when select people are about to die. Though he doesn't believe the doctor, events in Nathan's life slowly make him think he's not long for this world."
753,"Month by the Lake, A (1995)","Middle-aged suburban husband Richard abruptly tells his wife, Maria, that he wants a divorce. As Richard takes up with a younger woman, Maria enjoys a night on the town with her friends and meets a younger man. As the couple and those around them confront a seemingly futile search for what they've lost -- love, excitement, passion -- this classic American independent film explores themes of aging and alienation."
2738,Crimes of the Heart (1986),No description available
900,"American in Paris, An (1951)","David Huxley is waiting to get a bone he needs for his museum collection. Through a series of strange circumstances, he meets Susan Vance, and the duo have a series of misadventures which include a leopard called Baby."
2168,Dance with Me (1998),"At 2:37, someone commits suicide in the school lavatory. The day is told up to that point from the viewpoint of six different students."
3540,Passion of Mind (1999),
909,"Apartment, The (1960)",The life of a St. Louis family in the year before the 1904 St. Louis World's Fair.
697,Feeling Minnesota (1996),"Sergei M. Eisenstein's docu-drama about the 1917 October Revolution in Russia. Made ten years after the events and edited in Eisenstein's 'Soviet Montage' style, it re-enacts in celebratory terms several key scenes from the revolution."
3045,Peter's Friends (1992),No description available
1014,Pollyanna (1960),No description available
2829,"Muse, The (1999)",No description available
1018,That Darn Cat! (1965),"Blonde Betty Elms has only just arrived in Hollywood to become a movie star when she meets an enigmatic brunette with amnesia. Meanwhile, as the two set off to solve the second woman's identity, filmmaker Adam Kesher runs into ominous trouble while casting his latest project."
1453,"Beautician and the Beast, The (1997)",No description available
1600,She's So Lovely (1997),"Véronique is a beautiful young French woman who aspires to be a renowned singer; Weronika lives in Poland, has a similar career goal and looks identical to Véronique, though the two are not related. The film follows both women as they contend with the ups and downs of their individual lives, with Véronique embarking on an unusual romance with Alexandre Fabbri, a puppeteer who may be able to help her with her existential issues."
355,"Flintstones, The (1994)",No description available
35,Carrington (1995),"After Homer accidentally pollutes the town's water supply, Springfield is encased in a gigantic dome by the EPA and the Simpsons are declared fugitives."
287,Nina Takes a Lover (1994),"Veteran catcher Crash Davis is brought to the minor league Durham Bulls to help their up and coming pitching prospect, ""Nuke"" Laloosh. Their relationship gets off to a rocky start and is further complicated when baseball groupie Annie Savoy sets her sights on the two men."
289,Only You (1994),"In Casablanca, Morocco in December 1941, a cynical American expatriate meets a former lover, with unforeseen complications."
2339,I'll Be Home For Christmas (1998),No description available
1398,In Love and War (1996),"Near a gray and unnamed city is the Zone, a place guarded by barbed wire and soldiers, and where the normal laws of physics are victim to frequent anomalies. A stalker guides two men into the Zone, specifically to an area in which deep-seated desires are granted."
937,Love in the Afternoon (1957),No description available
2849,Queens Logic (1991),
2415,Violets Are Blue... (1986),
2417,Heartburn (1986),The young teacher Marelle goes in search of her husband who mysteriously disappeared while attending the funeral of a childhood friend.
3076,Irma la Douce (1963),"Grave robbers open the grave of the wolf man and awaken him. He doesn't like the idea of being immortal and killing people when the moon is full so tries to find Dr. Frankenstein, in the hopes that the doctor can cure him. Dr. Frankenstein has died; however, his monster is found."
371,"Paper, The (1994)",No description available
447,"Favor, The (1994)",No description available
2426,"Theory of Flight, The (1998)",No description available
2356,Celebrity (1998),No description available
1632,"Smile Like Yours, A (1997)","Two FBI agents investigating the murder of civil rights workers during the 60s seek to breach the conspiracy of silence in a small Southern town where segregation divides black and white. The younger agent trained in FBI school runs up against the small town ways of his partner, a former sheriff."
2292,Overnight Delivery (1996),"Convenience and video store clerks Dante and Randal are sharp-witted, potty-mouthed and bored out of their minds. So in between needling customers, the counter jockeys play hockey on the roof, visit a funeral home and deal with their love lives."
3814,Love and Death (1975),No description available
2443,Playing by Heart (1998),"Sherlock Holmes investigates a series of so-called ""pajama suicides"". He knows the female villain behind them is as cunning as Moriarty and as venomous as a spider. Based on ""The Sign of Four"" and the short stories ""The Dying Detective"", ""The Final Problem"", ""The Speckled Band"" and ""The Adventure of the Devil's Foot""."
469,"House of the Spirits, The (1993)","A Hungarian immigrant, his friend, and his cousin go on an unpredictable adventure across America."
1571,When the Cats Away (Chacun cherche son chat) (1996),"John McClane is back and badder than ever, and this time he's working for Homeland Security. He calls on the services of a young hacker in his bid to stop a ring of Internet terrorists intent on taking control of America's computer infrastructure."
2884,Dog Park (1998),No description available
1226,"Quiet Man, The (1952)",No description available
1083,"Great Race, The (1965)",No description available
489,Made in America (1993),"When professors discover that an aimless janitor is also a math genius, a therapist helps the young man confront the demons that are holding him back."
2468,Jumpin' Jack Flash (1986),No description available
1666,Hugo Pool (1997),The Bridge is a controversial documentary that shows people jumping to their death from the Golden Gate Bridge in San Francisco - the world's most popular suicide destination. Interviews with the victims' loved ones describe their lives and mental health.
2037,Candleshoe (1977),"Harry is a young millionaire on holiday; he takes his yacht to a Greek island, and stays in the mansion of his friend..."
633,Denise Calls Up (1995),"The lives of Erik Lanshof and five of his closest friends take different paths when the German army invades the Netherlands in 1940: fight and resistance, fear and resignation, collaboration and high treason."
492,Manhattan Murder Mystery (1993),"One day at work, unsuccessful puppeteer Craig finds a portal into the head of actor John Malkovich. The portal soon becomes a passion for anybody who enters its mad and controlling world of overtaking another human body."
566,Naked in New York (1994),No description available
205,Unstrung Heroes (1995),"Inspired by true events, this film takes place in Rwanda in the 1990s when more than a million Tutsis were killed in a genocide that went mostly unnoticed by the rest of the world. Hotel owner Paul Rusesabagina houses over a thousand refuges in his hotel in attempt to save their lives."
1677,Critical Care (1997),"Born on a sharecropping plantation in Northern Florida, Ray Charles went blind at seven. Inspired by a fiercely independent mom who insisted he make his own way, He found his calling and his gift behind a piano keyboard. Touring across the Southern musical circuit, the soulful singer gained a reputation and then exploded with worldwide fame when he pioneered coupling gospel and country together."
3280,"Baby, The (1973)",No description available
3939,"Slumber Party Massacre II, The (1987)",Dagwood brings home a pedigreed Great Dane which an important company client wants and which Blondie enters in the big dog show.
847,"Big Squeeze, The (1996)","The evil Queen Bavmorda hunts the newborn princess Elora Danan, a child prophesied to bring about her downfall. When the royal infant is found by Willow, a timid farmer and aspiring sorcerer, he's entrusted with delivering her from evil."
1969,"Nightmare on Elm Street Part 2: Freddy's Revenge, A (1985)","Set in the late 19th century. When a ruthless robber baron takes away everything they cherish, a rough-and-tumble, idealistic peasant and a sophisticated heiress embark on a quest for justice, vengeance…and a few good heists."
1102,American Strays (1996),No description available
1970,"Nightmare on Elm Street 3: Dream Warriors, A (1987)","An American nurse living and working in Tokyo is exposed to a mysterious supernatural curse, one that locks a person in a powerful rage before claiming their life and spreading to another victim."
1971,"Nightmare on Elm Street 4: The Dream Master, A (1988)",No description available
1972,"Nightmare on Elm Street 5: The Dream Child, A (1989)",No description available
1973,Freddy's Dead: The Final Nightmare (1991),No description available
1975,Friday the 13th Part 2 (1981),"A young woman encounters a malevolent supernatural force while searching for her missing sister in Tokyo, a mean high school prank goes horribly wrong, and strange things begin happening in a Chicago apartment building."
1978,Friday the 13th Part V: A New Beginning (1985),A struggling actress tries to help a friend prove his innocence when he's accused of murdering the husband of a high-society entertainer.
1979,Friday the 13th Part VI: Jason Lives (1986),"The Fantastic Four return to the big screen as a new and all powerful enemy threatens the Earth. The seemingly unstoppable 'Silver Surfer', but all is not what it seems and there are old and new enemies that pose a greater threat than the intrepid superheroes realize."
366,Wes Craven's New Nightmare (1994),No description available
1980,Friday the 13th Part VII: The New Blood (1988),A film about the cultural evolution of the Sydney beach side suburb of Maroubra and the social struggle faced by it's youth - the notorious surf gang known as the Bra Boys.
1981,Friday the 13th Part VIII: Jason Takes Manhattan (1989),No description available
3677,Baraka (1992),No description available
2523,Rollercoaster (1977),No description available
575,"Little Rascals, The (1994)",Das Experiment is a shocking psycho thriller about the potential for brutality that humans hide. Even more shocking is the fact that it’s based on an actual occurrence — a 1971 psychological experiment at Stanford University that was aborted prematurely when the experimenters lost control.
2050,Herbie Goes Bananas (1980),No description available
599,"Wild Bunch, The (1969)",A hack screenwriter writes a screenplay for a former silent film star who has faded into Hollywood obscurity.
2152,Air Bud: Golden Receiver (1998),"Shut Up and Sing is a documentary about the country band from Texas called the Dixie Chicks and how one tiny comment against President Bush dropped their number one hit off the charts and caused fans to hate them, destroy their CD’s, and protest at their concerts. A film about freedom of speech gone out of control and the three girls lives that were forever changed by a small anti-Bush comment"
1359,Jingle All the Way (1996),"A wealthy New York investment banking executive hides his alternate psychopathic ego from his co-workers and friends as he escalates deeper into his illogical, gratuitous fantasies."
829,Joe's Apartment (1996),"Private eye Jake Gittes lives off of the murky moral climate of sunbaked, pre-World War II Southern California. Hired by a beautiful socialite to investigate her husband's extra-marital affair, Gittes is swept into a maelstrom of double dealings and deadly deceits, uncovering a web of personal and political scandals that come crashing together."
835,Foxfire (1996),F.P.1 is a huge airplane landing dock in the Atlantic where pilots making the transatlantic flight can stop. Yet a saboteur tries to sink the technical wonder in this classic German science fiction film from 1932. The film was also created with English and French speaking actors at the same time.
836,Chain Reaction (1996),"In vivid images, the documentary-like story of a drover and his family in the northern badlands of Brazil during the drought. A family in the search of new hope and destiny."
1526,Fathers' Day (1997),No description available
1459,Absolute Power (1997),No description available
2401,Pale Rider (1985),A Swiss nun falls in love with a Japanese engineer.
1602,Leave It to Beaver (1997),No description available
1474,Jungle2Jungle (a.k.a. Jungle 2 Jungle) (1997),No description available
3404,Titanic (1953),A seductive woman gets involved in relationships with several people. All of the characters play games of deceit with one and other and things get more and more dangerous.
2531,Battle for the Planet of the Apes (1973),No description available
2532,Conquest of the Planet of the Apes (1972),No description available
991,Michael Collins (1996),"Thomas Jerome Newton is an alien who has come to Earth in search of water to save his home planet. Aided by lawyer Oliver Farnsworth, Thomas uses his knowledge of advanced technology to create profitable inventions. While developing a method to transport water, Thomas meets Mary-Lou, a quiet hotel clerk, and begins to fall in love with her. Just as he is ready to leave Earth, Thomas is intercepted by the U.S. government, and his entire plan is threatened."
996,Last Man Standing (1996),"A rich woman and a calculating insurance agent plot to kill her unsuspecting husband after he signs a double indemnity policy. Against a backdrop of distinctly Californian settings, the partners in crime plan the perfect murder to collect the insurance, which pays double if the death is accidental."
1752,Hard Rain (1998),No description available
1762,Deep Rising (1998),No description available
239,"Goofy Movie, A (1995)","Two musicians witness a mob hit and struggle to find a way out of the city before they are found by the gangsters. Their only opportunity is to join an all-girl band as they leave on a tour. To make their getaway they must first disguise themselves as women, then keep their identities secret and deal with the problems this brings - such as an attractive bandmate and a very determined suitor."
170,Hackers (1995),"Twenty-eight days after a killer virus was accidentally unleashed from a British research facility, a small group of London survivors are caught in a desperate struggle to protect themselves from the infected. Carried by animals and humans, the virus turns those it infects into homicidal maniacs -- and it's absolutely impossible to contain."
1931,Mutiny on the Bounty (1935),"After the death of his younger brother, a troubled 19-year-old street dancer from Los Angeles is able to bypass juvenile hall by enrolling in the historically black, Truth University in Atlanta, Georgia. But his efforts to get an education and woo the girl he likes are sidelined when he is courted by the top two campus fraternities, both of which want and need his fierce street-style dance moves to win the highly coveted national step show competition."
1797,Everest (1998),No description available
3615,Dinosaur (2000),No description available
1944,From Here to Eternity (1953),"The lives of Ted and Marion Cole are thrown into disarray when their two adolescent sons die in a car wreck. Marion withdraws from Ted and Ruth, the couple's daughter. Ted, a well-known writer, hires as his assistant a student named Eddie, who looks oddly similar to one of the Coles' dead sons. The couple separate, and Marion begins an affair with Eddie, while Ted has a dalliance with his neighbor Evelyn."
3477,Empire Records (1995),"Marseilles, 1919. Georges Sarret is a distinguished and respected lawyer, recently honoured for his services in the First World War. He takes as his lover Philomène Schmidt, a young German woman, who has just lost her job and home. To enable Philomène to remain in France, Georges finds her a husband – who dies conveniently of natural causes a month after the wedding. Georges repeats the trick with Philomène's sister, Catherine – marrying her off to an old man who dies suddenly so that the scheming trio can profit from his life insurance. When an accomplice in the scheme, Marcel Chambon, threatens to blackmail them, Georges and his two lovers have no option but to kill him and his mistress..."
336,"Walking Dead, The (1995)","At the beginning of the 1913 Mexican Revolution, greedy bandit Juan Miranda and idealist John H. Mallory, an Irish Republican Army explosives expert on the lam from the British, fall in with a band of revolutionaries plotting to strike a national bank. When it turns out that the government has been using the bank as a hiding place for illegally detained political prisoners -- who are freed by the blast -- Miranda becomes a revolutionary hero against his will."
15,Cutthroat Island (1995),"Newspaper magnate Charles Foster Kane is taken from his mother as a boy and made the ward of a rich industrialist. As a result, every well-meaning, tyrannical or self-destructive move he makes for the rest of his life appears in some way to be a reaction to that deeply wounding event."
19,Ace Ventura: When Nature Calls (1995),"In a futuristic city sharply divided between the rich and the poor, the son of the city's mastermind meets a prophet who predicts the coming of a savior to mediate their differences."
1010,"Love Bug, The (1969)",No description available
1011,Herbie Rides Again (1974),No description available
3483,"Road to El Dorado, The (2000)","Fu Manchu inoculates ten women with poison, to kill ten world leaders."
2827,"Astronaut's Wife, The (1999)",No description available
410,Addams Family Values (1993),When you read the title ‘Summer on the Balcony’ you probably think it will be a light Berlin summer comedy but it’s not. This film is an intimate study of two women friends who come to each other because of troubles with everyday life and with men and thus try to enjoy a life based on their ideas.
346,Backbeat (1993),"A samurai answers a village's request for protection after he falls on hard times. The town needs protection from bandits, so the samurai gathers six others to help him teach the people how to defend themselves, and the villagers provide the soldiers with food."
419,"Beverly Hillbillies, The (1993)",Director helmut Dietls and Patric Susskinds illustrate a legendary story of two lovers who cant keep themselves away from death.
423,Blown Away (1994),"The true story of pianist Władysław Szpilman's experiences in Warsaw during the Nazi occupation. When the Jews of the city find themselves forced into a ghetto, Szpilman finds work playing in a café; and when his family is deported in 1942, he stays behind, works for a while as a laborer, and eventually goes into hiding in the ruins of the war-torn city."
280,Murder in the First (1995),"Set ten years after the events of the original, James Cameron’s classic sci-fi action flick tells the story of a second attempt to get the rid of rebellion leader John Connor, this time targeting the boy himself. However, the rebellion has sent a reprogrammed terminator to protect Connor."
360,I Love Trouble (1994),No description available
2857,Yellow Submarine (1968),
513,Radioland Murders (1994),"In a barren, arranged marriage to an amateur swami who seeks enlightenment through celibacy, Radha's life takes an irresistible turn when her beautiful young sister-in-law seeks to free herself from the confines of her own loveless marriage."
514,"Ref, The (1994)",No description available
516,Renaissance Man (1994),No description available
374,Richie Rich (1994),No description available
54,"Big Green, The (1995)",No description available
376,"River Wild, The (1994)",No description available
453,For Love or Money (1993),"Brilliant mathematician, John Nash, is on the brink of international acclaim when he becomes entangled in a mysterious conspiracy."
